{"alg":"Ed25519","pack_id":"SOFTWARE_BUILDER.learner.v1","public_key_id":"TEST_ONLY","role":"learner","schema_version":"1.0.0","signature_b64":"xmPbr//yOqplgLgcH9iEwwtO5KA41V9EPHcafHkgALJKp7Od7Sd50Bw8xMYjpPsFayqI66Jmii6h1otiNAnvCQ==","signed_payload_sha256":"04713065b1657214bfffe87867afb818f59545dfc2c7533fdb8381e9908a6aed"}
