{"alg":"Ed25519","pack_id":"CYBER_SOC.learner.v1","public_key_id":"TEST_ONLY","role":"learner","schema_version":"1.0.0","signature_b64":"4lIiSZaI0Kpybv4qI7wdR/uxmTPNh45UIrecNewrLcStn3VNstNVu8GfNym5knEIAgcTP8SxAj6QC27crJxgDQ==","signed_payload_sha256":"8a3bfd69d7ad5963f61c608bfa38abec9e90582da292876101c90aa6e2ef9091"}
